{
  "root": {
    "label": "第25题",
    "definitions": [
      "Γ: y = -x^2+b*x+c"
    ],
    "facts": [
      "b,c ∈ ℝ",
      "c > 1",
      "P = vertex(Γ)",
      "Γ ∩ x_axis = {A,B}",
      "x(A) < x(B)",
      "Γ ∩ y_axis = {C}",
      "M ∈ axis(Γ) ∩ x_axis",
      "E ∈ axis(Γ)",
      "square(A,E,K,G)",
      "y(G) < 0"
    ],
    "children": [
      {
        "label": "（I）",
        "facts": [
          "b = -2",
          "c = 3"
        ],
        "children": [
          {
            "label": "①",
            "goals": [
              {
                "kind": "find_coordinates",
                "object": "P"
              },
              {
                "kind": "find_coordinates",
                "object": "A"
              }
            ]
          },
          {
            "label": "②",
            "facts": [
              "G ∈ Γ"
            ],
            "goals": [
              {
                "kind": "find_coordinates",
                "object": "E"
              }
            ]
          }
        ]
      },
      {
        "label": "（II）",
        "facts": [
          "A = (-c,0)",
          "F = midpoint(A,E)",
          "H ∈ segment(A,K) ∩ segment(E,G)",
          "min(HF+FM+MG) = 3*sqrt(5)"
        ],
        "goals": [
          {
            "kind": "find_coordinates",
            "object": "E",
            "at": "HF+FM+MG = min(HF+FM+MG)"
          }
        ]
      }
    ]
  },
  "match_status": "matched",
  "family_id": "QuadraticSquareReflectionPathMinimumSolver",
  "match_reason": "抛物线与以AE为边的正方形构造，以及中心和中点参与的路径最小值。"
}
