{"family_id":"QuadraticWeightedPathMinimumSolver","match_reason":"题面包含二次函数 Γ: y=-x^2+bx+c，路径目标 2DM+AM 带有非1权重2，并直接给出最小值 5+5√3，符合 QuadraticWeightedPathMinimumSolver 的 use_when。","match_status":"matched","root":{"children":[{"facts":["b = 4"],"goals":[{"kind":"find_coordinates","object":"vertex(Γ)"}],"label":"(1)"},{"children":[{"facts":["AD = 2*BC"],"goals":[{"expression":"b","kind":"find_value"}],"label":"(2)①"},{"definitions":["M = (m,0)，m > 0，M 是 x 轴正半轴上的动点"],"facts":["min_{M}(2*DM + AM) = 5 + 5*sqrt(3)"],"goals":[{"expression":"b","kind":"find_value"}],"label":"(2)②"}],"definitions":["D = (b+2, y_D)，且 D 在 Γ 上"],"label":"(2)"}],"definitions":["Γ: y = -x^2 + b*x + c，其中 b,c 为常数","A = (-1,0)，且 A 在 Γ 上","B: Γ 与 x 轴的另一交点（不同于 A）","C: Γ 与 y 轴的交点，C = (0,c)"],"facts":["b > 0"],"label":"25"}}