{"family_id":"QuadraticWeightedPathMinimumSolver","match_reason":"第(III)问含带权路径 √2 MN + AN（k=√2≠1）的最小值为21/4，且路径由二次函数与动点N给出，符合加权路径最值题型。","match_status":"matched","root":{"children":[{"definitions":["a = 1","b = 2","c = 3","P为抛物线Γ的顶点"],"facts":[],"goals":[{"kind":"find_coordinates","object":"P"}],"label":"（I）"},{"definitions":["a = 2","A = (-1,0)","A ∈ Γ","D ∈ Γ","C = Γ ∩ y_axis"],"facts":["∠CAD = 90°","AC = AD"],"goals":[{"kind":"find_coordinates","object":"D"}],"label":"（II）"},{"definitions":["a = 1","A = (-1,0)","A ∈ Γ","M = (b + 1/2, y_M)，M ∈ Γ","N = (n,0)，N是x轴正半轴上的动点"],"facts":["min_N(√2*MN + AN) = 21/4"],"goals":[{"expression":"b","kind":"find_value"}],"label":"（III）"}],"definitions":["抛物线 Γ: y = a*x^2 - b*x + c，其中a, b, c为常数，b > 0"],"facts":[],"label":"第25题","uncertainties":[]}}