{"family_id":"QuadraticEqualLengthRayPathMinimumSolver","match_reason":"题目包含二次函数（抛物线）、射线CD上的动点N、等长条件CN=CM以及路径和OM+BN的最小值，符合二次函数等长射线路径最值题型。","match_status":"matched","root":{"children":[{"children":[{"goals":[{"kind":"find_equation","object":"Γ"}],"label":"①"},{"facts":["E ∈ Γ","x(E) = m","-1 < m < 0","∠CBE + ∠ACO = 45°"],"goals":[{"kind":"find_coordinates","object":"E"}],"label":"②"}],"facts":["D ∈ Γ"],"label":"（Ⅰ）"},{"facts":["M ∈ segment(B,C)","N ∈ ray(C,D)","CN = CM","segment(O,M)","segment(B,N)","min(OM+BN) = sqrt(34)"],"goals":[{"expression":"a","kind":"find_value"}],"label":"（Ⅱ）"}],"definitions":["Γ: y = a*x^2+b*x-3"],"facts":["a > 0","A = (-1,0)","A ∈ Γ","Γ ∩ x_axis = {A,B}","Γ ∩ y_axis = {C}","D = C+(2,0)","segment(B,C)","O = (0,0)"]}}