{"family_id":"QuadraticEqualLengthRayPathMinimumSolver","match_reason":"题面包含二次函数抛物线、射线 CD 上的动点 N、等长条件 CN=CM，且等长条件参与 OM+BN 路径最小值的等价替换，符合 QuadraticEqualLengthRayPathMinimumSolver 的 use_when。","match_status":"matched","root":{"children":[{"children":[{"children":[],"definitions":[],"facts":[],"goals":[{"kind":"find_equation","object":"该抛物线"}],"label":"①","uncertainties":[]},{"children":[],"definitions":["E 为抛物线上的点，横坐标为 m"],"facts":["x(E) = m","-1 < m < 0","∠CBE + ∠ACO = 45°"],"goals":[{"kind":"find_coordinates","object":"E"}],"label":"②","uncertainties":[]}],"definitions":[],"facts":["D ∈ 抛物线"],"goals":[],"label":"(I)","uncertainties":[]},{"children":[],"definitions":["M 为线段 BC 上一动点","N 为射线 CD 上一动点"],"facts":["M ∈ segment(B,C)","N ∈ ray(C,D)","CN = CM","min(OM + BN) = √34"],"goals":[{"at":"OM+BN取得最小值 √34 时","expression":"a","kind":"find_value"}],"label":"(II)","uncertainties":[]}],"definitions":["抛物线 y = a*x^2 + b*x - 3（a,b为常数，a>0）","A = (-1,0)，B 为抛物线与x轴的另一交点","C 为抛物线与y轴的交点","D = C + (2,0)","线段BC"],"facts":["A ∈ 抛物线","B ∈ 抛物线 ∩ x_axis","C ∈ 抛物线 ∩ y_axis","D = C + (2,0)"],"goals":[],"label":"第(25)题","uncertainties":[{"kind":"ambiguous_symbol","text":"题面中 'O'（出现在 ∠ACO 和 OM 中）未明确说明其定义；可能指坐标原点，但题面未明示。"}]}}