{"family_id":"QuadraticSquareReflectionPathMinimumSolver","match_reason":"题面包含二次函数、正方形以及路径HF+FM+MG的最小值条件，且正方形AEKG的顶点、对角线交点和中点关系直接参与路径构造，符合该题型特征。","match_status":"matched","root":{"children":[{"children":[{"goals":[{"kind":"find_coordinates","object":"P"},{"kind":"find_coordinates","object":"A"}],"label":"①"},{"facts":["G ∈ Γ"],"goals":[{"kind":"find_coordinates","object":"E"}],"label":"②"}],"facts":["b = -2","c = 3"],"label":"（Ⅰ）"},{"facts":["A = (-c,0)","F = midpoint(A,E)","segment(A,K) ∩ segment(E,G) = {H}","min(HF+FM+MG) = 3*sqrt(5)"],"goals":[{"at":"HF+FM+MG = min(HF+FM+MG)","kind":"find_coordinates","object":"E"}],"label":"（Ⅱ）"}],"definitions":["Γ: y = -x^2 + b*x + c"],"facts":["c > 1","P = vertex(Γ)","Γ ∩ x_axis = {A,B}","x(A) < x(B)","Γ ∩ y_axis = {C}","axis(Γ) ∩ x_axis = {M}","E ∈ axis(Γ)","square(A,E,K,G)","y(G) < 0"]}}