{"family_id":null,"match_reason":"题面为二次函数在恒成立/存在性条件下求参数最值与取值范围，不属于已注册的路径最值题型。","match_status":"unmatched","root":{"children":[{"facts":["∀x∈ℝ: f(x) ≥ g(x)"],"goals":[{"expression":"b^2+c^2","kind":"find_minimum"}],"label":"(1)"},{"facts":["∃x0∈[1,3]: f(x0) ≤ g(x0)"],"goals":[{"in_terms_of":["c"],"kind":"find_range","symbol":"b"}],"label":"(2)"}],"definitions":["f(x)=x^2+b*x+c","g(x)=2*x-1"]}}